,,,,,
text,Thibaut_HS,Naomie_HS,fortune_HS,yolande_HS,GPT_HS
"No wikileakes from Kim Dotcom... nothing... zip... zero And there never will be from this bankrupt wannabe criminal waiting to be extradited to the US. Page 1 Related Threads 1 Mail with questions or comments about this site. ""Godlike Productions"" & ""GLP"" are registered trademarks of Zero Point Ltd. Godlike™ Website Design Copyright © 1999 - 2015 Godlikeproductions.com Page generated in 0.007s (8 queries)",2 (Disrespect),2 (Disrespect),2 (Disrespect),3 (Hostile),2
"WASHINGTON (Reuters) - There has been no evidence of widespread election fraud in the Nov. 8 presidential contest, the White House said on Monday in reaction to U.S. President-elect Donald Trump’s tweet over the weekend alleging millions of illegal votes and fraud in three states.  White House spokesman Josh Earnest, speaking to reporters at a daily briefing, deferred comments on Trump’s specific tweets to the president-elect’s team, but added: “What I can say, as an objective fact, is that there has been no evidence produced to substantiate a claim like that.” ",0 (Neutral),0 (Neutral),1 (Mild),0 (Neutral),0
"October 28, 2016 Let’s Be Clear—A Vote for Warmonger Hillary Clinton Is a Vote for World War 3 
If you want to see war without end, vote for Hillary Clinton. 
It is tremendously ironic that Hillary Clinton and the mainstream media have attempted to portray Donald Trump as “dangerous” and “temperamental” because it is Clinton who actually has a long history of being emotionally unstable. She has a temper that is absolutely legendary, and she has been cussing out the men and women in her security detail for decades. 
Hillary Clinton played a key role in starting the civil war in Syria, thanks to her Libya is a post-apocalyptic wasteland today, and now she is picking a fight with the Russians before she has even won the election. Of all the candidates there were running for president this election cycle, there was nobody that was even close to as dangerous as Hillary Clinton, and if she wins the election, I am fully convinced that World War III will begin before her time in the White House is over. 
Someone that shares this opinion with me is Donald Trump. According to Reuters, Trump recently stated that we are “going to end up in World War III over Syria if we listen to Hillary Clinton”:",3 (Hostile),3 (Hostile),3 (Hostile),4 (Hateful),3
"Part of the problem is that organizations are registering people without  any proof they are legal American citizens .Leaked funding documents reveal an effort by George Soros and his foundations to manipulate election laws and process rules ahead of the federal election far more expansively than has been previously reported.The billionaire and convicted felon moved hundreds of millions of dollars into often-secret efforts to change election laws, fuel litigation to attack election integrity measures, push public narratives about voter fraud, and to integrate the political ground game of the left with efforts to scare racial minority groups about voting rights threats.These Soros-funded efforts moved through dozens of 501(c)(3) and (c)(4) charities and involved the active compliance with civil rights groups, government officials, and purportedly non-partisan groups like the League of Women Voters.The leaked documents also reveal deliberate and successful efforts to manipulate media coverage of election issues in mainstream media outlets like the The New York Times.IF YOU LIVE IN ONE OF THE STATES BELOW, PLEASE DEMAND THAT VOTER ID IS ENACTED: Although some states require some form of ID before voting, California, Illinois, Iowa, Maine, Maryland, Massachusetts, Minnesota, Nebraska, Nevada, New Jersey, New Mexico, New York, North Carolina, Oregon, Pennsylvania, Vermont, West Virginia, Wyoming, and Washington, D.C. all require no identification before voting.Please contact True the Vote for any and all information regarding voter fraud. Via: Info WarsHere s Obama essentially telling illegal aliens it s okay to vote, no one will catch you:",0 (Neutral),2 (Disrespect),1 (Mild),0 (Neutral),3
"Comments 
Throughout this election, Hillary Clinton has been claiming to be a “warrior for women” who will do everything in her power to help victims of sexual assault. That’s why it came as bad news to her when the video above this story surfaced… 
Infowars reported that the video shows child rape victim Kathy Shelton explain how Clinton allowed her rapist to go free when she was his defense lawyer, even thought she knew he was guilty. Afterwards, Clinton was caught on a recording laughing about the fact that she’d just knowingly set a child rapist free. 
“He took a lie detector test,” Clinton said on the recording, according to The American Thinker. “I had him take a polygraph, which he passed, which forever destroyed my faith in polygraphs (laughs).” 
SHARE this story so we can spread Shelton’s story and let people see who Hillary Clinton REALLY is! ",2 (Disrespect),2 (Disrespect),2 (Disrespect),0 (Neutral),2
"Never let an opportunity go to waste. Its the Democrat mantra Whenever a black person dies, no matter what the circumstances, the first and most important question is: How can Al Sharpton turn this into dollars? With the death of funk/pop icon Prince yesterday, you re probably thinking there is no way the race-hustling Reverend can turn the tragedy into social justice (AKA cold hard cash) but you re underestimating his awesome powers of exploitation.The Amsterdam News reports that Al Sharpton will be holding a rally on Saturday at the National Action Network s House of Justice in New York. I m not kidding, he really has a place he calls the  House of Justice.  The original purpose of this rally was to protest the police shooting a black guy who pointed a gun at officers, but with Prince s untimely death, Sharpton has decided to combine faux outrage with a faux tribute.Here s the black guy who was  wronged  by a racist system:Tillman was fatally shot by NYPD officers on Sunday in Ozone Park, Queens. Reports indicate that he was allegedly holding an open alcohol container when officers approached him. Tillman had a gun on his waistband and allegedly ran as they approached him. Police say he reached for the weapon before officers opened fire shooting Tillman in the chest. He was pronounced dead at Jamaica Medical Center.Let s see if I have this correctly: A black guy was carrying an illegal firearm in NYC and violating the city s drinking in public law. When police tried to question him, he resisted arrest and took off. He then took out the illegal firearm and pointed it at officers and they responded by shooting him. In other words, police used appropriate force to deal with a violent life-threatening situation. How exactly is this a case of racial injustice? Oh, because the guy was black. I get it now.I guess it s getting harder and harder for Sharpton to find any real racism to rage against, so he has to work with what he s got.Just in case people have a hard time freaking out over a justified police shooting, Big Al is throwing in a tribute to Prince to get asses in the seats:As the aftermath of the death of singer Prince continues, Sharpton will conduct a special memorial in honor of the legendary entertainer and humanitarian.I wasn t aware there was  aftermath  from Prince s death, but it sure does seem like a shitty tribute to combine this with some bogus racial outrage over a guy who got shot for trying to kill some cops.Really the only question left is: how will Sharpton blame Prince s death on white supremacy? Was there a white conspiracy to kill the singer? Did he die because white EMTs responded slower than they would have if Prince were white? Did a white man give him the flu and force him to take opioids?Via: DownTrend ",0 (Neutral),3 (Hostile),3 (Hostile),1 (Mild),4
"— Steven (@superaielman) October 26, 2016 
Earlier today, GOP vice presidential candidate Mike Pence shared some very sad news with his Twitter followers: Heavy hearts today. Our beagle of 13 years passed away quietly last night. Rest In Peace, Maverick. We will miss you. pic.twitter.com/JPnFvsHB3Y 
— Mike Pence (@mike_pence) October 26, 2016 
But, while many offered their sympathy, this was all Jezebel could muster: An October surprise for Mike Pence's dog: death https://t.co/qxuapnkCM9 pic.twitter.com/GlBYntaJi1",1 (Mild),1 (Mild),1 (Mild),0 (Neutral),1
"KABUL (Reuters) - A top leader of militant group al-Qaeda was killed along with 80 people in a joint military operation by Afghan army, intelligence and NATO-led forces, the South Asian nation s intelligence service said on Tuesday.  Omar Khetab, also known as Omar Mansoor, was the most senior member of his branch of the group killed in Afghanistan, the National Directorate of Security said in a statement.     Security forces also arrested 27 individuals in the operation in the eastern Afghan provinces of Ghazni, Paktia and Zabul, the agency said, without giving further details. ",0 (Neutral),0 (Neutral),1 (Mild),0 (Neutral),0
"MADRID (Reuters) - Support for the creation of an independent state of Catalonia rose to an almost 3-year high in October according to an official regional survey published on Tuesday.  Some 48.7 percent of Catalans believe the Spanish region should be independent, according to the poll from Centre d Estudis d Opinio, up from 41.1 pct in June and the highest since December 2014.  The poll was based on 1,338 interviews taken between Oct. 16 and Oct. 29. ",0 (Neutral),0 (Neutral),1 (Mild),0 (Neutral),0
"Posted on October 31, 2016 by Theodore Shoebat 
A major political leader in France, Francois-Xavier Peron , has declared that France is about to enter into a devastating war against Islam , and its going to be extremely violent. His solution to prepare? Embrace the Christian Faith and never accept the antichrist masonic religion . 
I did an interview with Mr. Peron about this coming war, and why the Christian Faith must be the religion of the world: 
Courtesy of Freedom Outpost 
Theodore Shoebat is the Communications Director for Rescue Christians , an organization that is on the ground in Muslim lands, rescuing Christians from persecution. He is the author of two book, For God or For Tyranny and In Satan’s Footsteps: The Source and Interconnections of all Evil , he also has a DVD series called “Christian Militancy,” which is on Christian warfare and our fight against evil and tyranny. 
Article posted with permission from Shoebat.com Don't forget to follow the D.C. Clothesline on Facebook and Twitter. PLEASE help spread the word by sharing our articles on your favorite social networks. Share this:",3 (Hostile),1 (Mild),2 (Disrespect),1 (Mild),3
" Punishment is not for revenge, but to lessen crime and reform the criminal  -Elizabeth FryThis homeowner was apparently sick and tired of having his Trump sign stolen, so he provided a little booby-trap for the next sneaky liberal who attempted to steal his personal property. Enjoy:",0 (Neutral),1 (Mild),1 (Mild),0 (Neutral),2
"SWEDEN HELP WANTED: Activities Coordinator for bored illegal alien Muslim freeloaders and rapists Muslim illegal alien invaders taking up space in Sweden and living off the government dole, say they are vandalizing and burning cars (not to mention gang-raping Swedish girls) because they do not have enough “activities” to keep them busy. Friatider “It is clear as hell that we take out our frustration by destroying and vandalizing when we have a shortage of activities here,” one of the illegals living in Skallberget in Vasteras writes in a letter to the editor in the local newspaper VLT. Vasteras has recently been subjected to a long series of car fires. The submitter tries the young man, who wishes to remain anonymous, explain what the phenomenon is due. He writes that he came to Sweden when he was young and admittedly had “good potential” but that he was subject to persistent “racism” by the authorities. (What “race” is Islam?) “Already at an early age became a man treated differently. Sometimes it was because of ethnicity, sometimes because they were at a certain place, and sometimes just to those very people who were in power felt to fuck with us. So many times I had been propped up against the wall and strip-searched in front of my loved ones. It really depressed me and my value, “he writes. The man writes that the young people in the area feel “oppressed” and that they are burning cars to “get the environment to react and listen.” Among other things, he complains that the objectives of the local football field does not have a network and that it is not organized enough “activities” for young people. “In short, it is clear as hell that we take out our frustration by destroying and vandalizing when we have a shortage of activities here. There is neither good fellowship, activities and things / objects we can make use of.” Submitters have received several responses from readers who are critical of the reasoning. “It’s just a matter of time before someone of obtained or ‘the others’ die if this continues. No pity you – all just hate you more and more,” writes , for example, the signature “Former car owners on Skallberget”. 
v",1 (Mild),4 (Hateful),2 (Disrespect),3 (Hostile),4
"The   Islamic state magazine Rumiyah has called on supporters and Islamic State fighters in Germany and Austria to murder moderate Imams who they consider  “apostates. ”[The magazine was released in several languages earlier this week through the various internet channels Islamic State uses to broadcast propaganda to its sympathisers, MEMRI reports. One of the methods used was a “telegram” app, an encrypted messaging service that ISIS often uses and is generally the first place the group takes credit for terror attacks.  The terror group named several prominent members of the Muslim community in both Germany and Austria as potential targets for assassination in an article entitled “Kill the infidel imams in Germany and Austria. ” Among the targets listed is Aiman Mazyek,   of the Central Council of Muslims in Germany. Mazyek has made controversial statements in the past, such as calling for German leaders to limit the number of migrants flowing into the country in late 2015. The Muslim leader has also slammed the   migration Alternative for Germany (AfD) likening them to Nazis after they revealed a platform of   last year. Omar   a Vienna city councilman for the Socialist Party (SPÖ) and a member of the Council Committee on European and International Affairs was also listed as a target.   is also no stranger to controversy  —   in 2010 he led an official condemnation of Israel in the Vienna city hall over the Israeli raids on a flotilla heading for Gaza, which Israeli authorities claimed was not the  humanitarian mission activists stated it to be.   also led a protest against Israel in Vienna. Among the demonstrators were members of the Turkish   nationalist group the Grey Wolves who have clashed with Kurds in Germany and have been accused of trying to infiltrate German Chancellor Angela Merkel’s Christian Democratic Union (CDU) party through its diversity program. Killing Imams they don’t agree with is nothing new for the Islamic State. In 2014 ISIS executed 13 clerics in the city of Mosul whom they deemed to be too moderate. Imam Muhammad al Mansuri was one of the victims of the terror group and was the imam in charge of the mosque in which ISIS leader     gave a rare public appearance to lead prayers. Islamic State killed a further six imams in early 2015 after they condemned the group’s actions when they burned Jordanian pilot Mu’ath Kasasbeh alive.  Follow Chris Tomlinson on Twitter at @TomlinsonCJ or email at ctomlinson@breitbart. com,    ",3 (Hostile),4 (Hateful),4 (Hateful),1 (Mild),4
"When Sharia Law becomes the official law of the EU, see how many bleeding heart liberals will be wishing they could turn back time. It s only a matter of time before the Dutch women will clad in head-to-toe burqas. How very progressive With the mass Muslim migration into Eurabia comes the Islamic law and its attendant misogyny, pedophilia and misogyny. That s to be expected. What was not expected when I began to engage in this fight 15 years ago was the sanction of this brutal and extreme ideology by Western leaders in academia, media and politics.Child brides present at Danish asylum centers, & the leaders allow it! By DioDK, January 27, 2016: That is according to MetroXpress (Denmark s most popular free newspaper)Girls down to the age of 14 seek asylum in Denmark as child brides.The younger ones stay at a special asylum center for children. Many of them have a husband with a residence permit. They are allowed to sleep with their older husbands in the weekends.Several political parties wish to stop this. Naser Khader (very responsible conservative who is pretty much against Islam all together) says that these people should not be allowed to get asylum at all.Sofie Carsten Nielsen from the political party  De radikale  literally translating to  The radicals  says:  It is in regards to the law the same as mismanagement of children. If a 14 year old is married, it must be arranged. The asylum center and police need to respond to this.Integration Minister Inger St jberg (very hated for her stand on immigration) wants to stop that the children are allowed to sleep with their husbands in the weekends.[Age of consent in Denmark is according to a quick Google search 15 years old. You can get married at 18.This is PC out of control. People are so afraid to be called racist that they will go along with ANYTHING and allow ANYTHING from Muslims, even pedophilia.] Via: Pamela Gellar ",2 (Disrespect),4 (Hateful),4 (Hateful),1 (Mild),4
"JERUSALEM (Reuters) - Israel’s intelligence minister said U.S. President Donald Trump’s speech against the 2015 international nuclear deal with Iran on Friday was “very significant” and could lead to war given threats that preceded it from Tehran. Israel’s Channel 2 TV asked Intelligence Minister Israel Katz whether he saw a risk of war after Trump’s speech. “Absolutely, yes. I think that the speech was very significant,” Katz responded. “Iran is the new North Korea. We see where things are goings.” ",2 (Disrespect),0 (Neutral),3 (Hostile),1 (Mild),1
"175 Views Share: Commentary — Seriously, you always hear that we mustn’t deport people because it could break up families. Yet we are encouraging teenagers to run away from their families and try their luck on America’s streets! Latino Invasion Set for New Record 
The New Observer March 2, 2016 
More than 17,000 “unaccompanied alien minors” had invaded the US over the Mexican border in the past few months, and the number of “family units” has increased to 21,000, the US House Judiciary Subcommittee on Immigration and Border Security has been informed. 
The House was also told that if the present trends continue, there will be a 30 percent increase on the record number of 260,000 invaders who entered the US in 2014. 


“In the past few months the number of unaccompanied alien minors unlawfully entering the US soared to over 17,000 and the number of family units increased to 21,000,” Chair Rep. Trey Gowdy (R-SC) informed the US House Judiciary Subcommittee on Immigration and Border Security in a February 4 hearing on Capitol Hill. 
“If these trends continue it is predicted there will be a 30 percent increase in the record high numbers we witnessed in 2014.” 
The widespread criminal violence endemic in the nonwhite Third World countries to the south continues to be a major factor in the ongoing invasion, Omar Zamora, public affairs officer for the US Border Patrol Rio Grande Valley (RGV) Sector told the local KVUE TV station. 
“We’ve got gangs over there that are controlling the neighborhoods, controlling the cities,” Zamora said. 
Agents of the RRGV Sector, he said, “man the front lines of the battle against drug trafficking and human smuggling.” 
The US government has mounted an ad campaign along the Guatemala–Honduras border warning would-be invaders what to expect from human traffickers. 
According to Zamora, the human traffickers engage in everything from child molestation and rape to extortion and fraud. READ Cologne Police Officer Confirms: It was “Refugees” 
“I think the biggest misconceptions are, ‘Hey they’re just children down there, right? It’s a humanitarian crisis,’” said Zamora, “But what I want to stress is there’s the 50 percent of the other individuals that are running, that are fighting, that have criminal records.” 
Rep. Lamar Smith (R-TX), who chairs the House Border Security Caucus, told KVUE that “If people figure they have a 95 percent chance of being allowed to stay and work and get government benefits, they’re going to come no matter what they might hear on the street or on the radio or see in a leaflet.” 
In a February 23 hearing of the Senate Judiciary Committee, Sen. John Cornyn (R-TX) asked agency Acting Chief Ronald Vitiello whether giving undocumented immigrants the impression they won’t be allowed to stay in the US without a legal claim would act as a deterrent and slow the flow of unauthorized crossings. 
“Yes, I believe that matters,” Vitiello answered.",1 (Mild),3 (Hostile),3 (Hostile),1 (Mild),4
"So words deemed offensive are only offensive if you re white? Isn t that racist? Shouldn t the same punishment be given to people no matter the color of their skin? We d love to know your thoughts on this.A high school baseball player lost his scholarship to Cal State for being overheard using the term  nigger. Meanwhile, a college basketball player kept his scholarship after being overheard using the word on live television.One was white, one was black.The leftist explanation that it s acceptable for blacks to call each other socially unacceptable epithets makes little sense. It makes about as much sense as the #BlackLivesMatter meme being created only after a handful of black deaths at the hands of white people, meanwhile thousands of black on black deaths garnered no similar sloganeering.White progressives declaring it okay for blacks to use epithets on each other is most likely their way of having the epithet used for them by proxy. It keeps blacks psychologically under-classed, but their hands are ostensibly clean. Read more: iotw",1 (Mild),3 (Hostile),1 (Mild),1 (Mild),3
"It s come to this legal citizens are being pushed aside for the  refugee  invaders. Sweden began to import refugees decades ago and now has a reputation for being a failed experiment in multiculturalism. Yes, Sweden is now the rape capital of the world. Say goodbye to Sweden A local family in the Swedish city of Liding  has been ordered by the government to leave their home so that it can be given to migrants arriving from a foreign country.Father of two teenage boys Uffe Rustan received a voicemail from his local municipality telling him he would need to vacate the property by August in order to make way for asylum seekers from the Middle East.  I was evicted from my home over the phone. When I asked for the reason, he said that people come from other countries. He left the news and basically just said have a nice weekend,  Rustan told a newspaper.Rustan lives with his teenage sons Rasmus (15) and Linus (17), all of whom were born in Liding . He rents the home from the city and has been living in it for less than a year.  It feels like I m worthless, even though I pay taxes and my kids go to school here. You cannot put a family on the streets for another family,  said Rustan.  Just when it starts to feel like home, we are evicted.  Rustan said that the news was  depressing  and wondered why native Swedes were being treated worse than migrants arriving in the country for the first time. Despite suffering from a housing shortage, Sweden is handing over property to economic migrants, with some politicians even encouraging citizens to give up their garages to asylum seekers. Sweden is not the only European government that is turfing its own citizens out of social housing to accommodate the influx of Muslim migrants. While migrants are in some cases enjoying all the comforts of good quality hotels, low income Germans are being ordered to leave their homes. As the Telegraph reported, Germans are beginning to receive notices of eviction to make way for asylum seekers.Read more: InfoWars",0 (Neutral),3 (Hostile),2 (Disrespect),1 (Mild),4
"This video is so disturbing but is a great example of ZERO PARENTING! The kids were riding the subway attacking different passengers. Patrick Coyle started recording after the kids slapped a lady. They then turned on him: (function(d, s, id) {  var js, fjs = d.getElementsByTagName(s)[0];  if (d.getElementById(id)) return;  js = d.createElement(s); js.id = id;  js.src = ""//connect.facebook.net/en_GB/sdk.js#xfbml=1&version=v2.3"";  fjs.parentNode.insertBefore(js, fjs);}(document, 'script', 'facebook-jssdk'));Please show this to the right personPosted by Patrick Coyle on Thursday, 24 March 2016",0 (Neutral),1 (Mild),1 (Mild),1 (Mild),1
