,,,,,
"GERMANY: “We are Somali Muslims, we don’t have to pay” In Wabern, Hesse, a group of five Somali Muslim freeloaders sat down and had drinks at the “Piano” pub. The group was there for the first time and Albayrak [the owner] didn’t know them. They drank “eight beers, two vodkas” and put everything on a tab. When Albayrak want to collect payment, there was anger. “We are Somalis, we don’t pay.” Source Two of the savages stood up and went out. Albayrak banned the other three from the establishment and threw them out. “They were very aggressive, they were upset,” says Albayrak. The pub owner then shut the door. Suddenly, the owner heard a noise from outside. There was a “boom, boom” sound. Albayrak looked out and saw two of the Somali Muslim thugs with iron rods beating on the pub door, shattering the glass. “I was afraid they were going to kill me,” says the 58-year-old. He called the police but they didn’t arrive for a half hour, and by then, the savages were already gone.",2 (Disrespect),3 (Hostile),1 (Mild),1 (Mild),4
"BERLIN (Reuters) - Chancellor Angela Merkel said on Thursday that Germany would stand by U.N. resolutions on the Israel-Palestinian conflict after U.S. President Donald Trump decided to recognize Jerusalem as the capital of Israel.  We re sticking to the relevant U.N. resolutions - they make clear that the status of Jerusalem needs to be negotiated as part of negotiations on a two-state solution for Israel and that s why we want this process to be revived,  she said. On Wednesday Merkel had already said Germany does not support the Trump administration s decision. ",1 (Mild),0 (Neutral),0 (Neutral),1 (Mild),0
"Report Copyright Violation Even if you hate Hillary you have to give her props for making this race a referendum on Trump Most people voting for Hillary have no idea where she stands on the issues or what her policies are, they just have been told Trump is a bad man and they should vote for Hillary Page 1",1 (Mild),1 (Mild),1 (Mild),0 (Neutral),1
"WASHINGTON (Reuters) - U.S. Republican presidential candidate Ted Cruz on Tuesday called the blasts in Belgium “the latest in a string of coordinated attacks by radical Islamic terrorists,” adding that they “are no isolated incidents.” “Radical Islam is at war with us,” he said in a statement posted online. ",,1 (Mild),3 (Hostile),2 (Disrespect),1
"Since sexual harassment is almost a sport at Fox News, it is unsurprising that a man who worked as a Miami correspondent for the network until fairly recently was just arrested for raping someone.Orlando Salinas, who worked for the network from 2000-2012 until he was hired by a CBS affiliate in Roanoke, Virginia, was arrested Tuesday and charged with forcible sodomy and rape. Due to the horrific nature of the allegations, the victim s identity is being shielded but reports specify that the accuser is not his wife or a relative.Salinas, whose prior criminal record includes contributing and three counts of larceny, faces five years to life for each of his felony charges.Salinas was an employee of WDBJ7 from 2012-2015, but was terminated last April for  insubordination.  Since then, he has been working as a real estate agent in the New River Valley. In a  whatever happened to  article published by the Roanoke Times in December, Salinas  current employer called him a  wonderful person  and said that  people who know who he is really trust him.  The judge, however, apparently doesn t really know him because he is being held without bail for the horrific crimes.Salinas told the Times that his firing was the result of a refusal to  tone down  his aggressive interview style, an idea with which he disagreed because he seeks  truth like a missile.  But, hey, he says  some of the most annoying people make the best reporters.  Seems like they make pretty accomplished rapists, too.Watch a report on the Fox contributor s arrest below:Featured image via screengrab",2 (Disrespect),3 (Hostile),3 (Hostile),2 (Disrespect),3
"WASHINGTON (Reuters) - President Barack Obama will officially nominate acting Education Secretary John B. King to fill the post permanently, he said in a statement on Thursday, urging the Senate to quickly confirm King for the job. King has been the acting secretary since the beginning of the year, after Arne Duncan stepped down from the post. The White House had said in January that it was unclear whether the Republican-controlled U.S. Congress would confirm King in the year remaining in Obama’s presidency. ",0 (Neutral),0 (Neutral),1 (Mild),0 (Neutral),0
"Next Swipe left/right In this short Peppa Pig clip it sounds very VERY much like it’s swearing. Naughty Mr Rabbit! 
People are saying that in this clip you can hear Peppa Pig say, “That’s right, she played guitar with the fucking gazelles.” 
Blimey!",1 (Mild),3 (Hostile),3 (Hostile),1 (Mild),0
The social justice warriors are being terrorized by the chalk bandit Bahahaha!,1 (Mild),2 (Disrespect),4 (Hateful),1 (Mild),2
"Black mob goes crazy and attacks fair ride operator at the Delta Fair in Tennessee. what they attacked him for is just so lame he wasn t loading kids fast enough. so the poor kids looked on in horror as the ride operator was pummeled. Update: Memphis Police have arrested a man who allegedly started a fight at the Delta Fair Sunday afternoon.24-year old Antonio Butler is the man seen at the center of what appeared to be an all-out brawl in front of a ride at the fair. Police say the fight started because Butler wasn t admitted on the ride because it was full at the time. After Butler was denied he, along with a few others, became irate and the attack began.A fair patron recorded the fight and put the video on Facebook, which has since received millions of views. Many of the comments on the video express concerns about safety at the fair, and whether or not it will return for another year. Sunday was the last day for the fair.Everyone involved in the fight was escorted off the premises shortly after. Butler now faces assault charges.",3 (Hostile),1 (Mild),1 (Mild),1 (Mild),2
"Democrats are in panic mode since Hillary Clinton s been coughing, barking and screeching on the campaign trail. This video from Rush Limbaugh is pretty darn funny:Health questions have been raised since Hillary has been having repeated coughing fits. The funny thing is that CNN covered for her by saying she was  choked up  during her speech.HILLARY HAS A COUGHING FIT DURING NEW YORK SPEECH: ",2 (Disrespect),2 (Disrespect),1 (Mild),1 (Mild),2
"BNI Store Oct 31 2016 Do Canadian taxpayers know they are funding welfare for polygamous Muslim migrant families with up to 4 wives and countless children? Canadian Liberals have been stonewalling on any access to information requests relating to the Syrian Muslim migrants they’ve been shipping in by the tens of thousands . They’re either embarrassed by the facts or don’t even want to know what the facts actually are. Back in 2008, Toronto media left and right reported on hundreds of polygamous Muslim families in Toronto, many on welfare. Has anything changed? Neither Canada’s government nor its welfare agencies bother to screen for polygamous marriages. And the media won’t breathe a word about it.",1 (Mild),2 (Disrespect),1 (Mild),1 (Mild),3
"PARIS (Reuters) - France has appointed Philippe Leglise-Costa as its new permanent representative to the European Union (EU), replacing Pierre Sellal in a crucial role dealing with matters such as Brexit and the EU s budget. The experienced Leglise-Costa was EU adviser to former Socialist President Fran ois Hollande, when current President Emmanuel Macron was deputy chief of staff.  It s a key position,  said government spokesman Castaner, commenting on the appointment.  He is certainly the one who knows European topics the best.          ",1 (Mild),0 (Neutral),1 (Mild),0 (Neutral),0
"TREASON: OUR BANANA REPUBLIC EXPOSED — Bill Holter   Tweet 
Hillary Clinton is the Queen of the New World Order and the mainstream mockingbird media is colluding with the DNC and the Clinton campaign to HIDE her documented crimes from the American people. JS Mineset’s Bill Holter is back to help document the collapse. Bill says that the United States is becoming a banana republic right before our eyes. As Donald Trump recently stated, “The Clinton machine is at the center of this power structure. We’ve seen this firsthand with the Wikileaks documents in which Hillary Clinton meets in secret, with international banks to plot the destruction of U.S. sovereignty. The Clintons are criminals.” And still, the CIA mockingbird media targetsTrump while giving Clinton a free pass. The fix is in.",2 (Disrespect),3 (Hostile),0 (Neutral),1 (Mild),3
"Remember Will and Jada Pinkett Smith s contribution to this racist, anti-Jew, anti-Christian clown the next time you plunk down $12   $15 to see one of his movies Here is the post taken from Louis Farrakhan s Facebook page announcing his gratitude to mega-donors Will and Jada Pinkett Smith. What s in it for Will and Jada Pinkett-Smith? Why would they make this kind of a donation to one of the most hateful and racist men in Ameirca?// <![CDATA[ (function(d, s, id) { var js, fjs = d.getElementsByTagName(s)[0]; if (d.getElementById(id)) return; js = d.createElement(s); js.id = id; js.src = ""//connect.facebook.net/en_US/sdk.js#xfbml=1&#038;version=v2.3""; fjs.parentNode.insertBefore(js, fjs);}(document, 'script', 'facebook-jssdk')); // ]]>Last night in Philadelphia, The Honorable Minister Louis Farrakhan announced that he called upon Will Smith and Jada Watch Will Smith and his radical wife Jada Pinkett Smith gush over our Racist In Chief and his racist wife, Barack and Michelle Obama. He also talks about how he had to overcome the criticism of Smith s music catering to white people:https://youtu.be/ZVSA44-c9xg",2 (Disrespect),4 (Hateful),3 (Hostile),1 (Mild),3
"Notify me of follow-up comments by email. Notify me of new posts by email. PLEASE DONATE TO KEEP BARE NAKED ISLAM UP AND RUNNING. Choose DONATE for one-time donation or SUBSCRIBE for monthly donations Payment Options GET ALL NEW BNI POSTS/LINKS ON TWITTER Subscribe to Blog via Email 
Enter your email address to subscribe to this blog and receive notifications of new posts by email. Email Address",2 (Disrespect),0 (Neutral),0 (Neutral),1 (Mild),0
"James Harris Jackson, 28, eventually surrendered to police in New York City to admit to fatally stabbing a 66-year-old black man in the chest with a 26-inch sword that has an 18-inch blade. The sword exited the victim s back after being plunged into his chest. Jackson, an army veteran from Baltimore, held a long-time hatred of black people and had traveled to Manhattan with the goal of killing black men.This is an attack you won t see amateur president Donald Trump tweeting about.Timothy Caughman, 66, the white supremacist s victim, stumbled into a police station bleeding from stab wounds to his chest and back, Assistant Chief William Aubry, the commander of Manhattan South detectives, told reporters at Police Headquarters, according to the New York Times.After taking down his first victim, Jackson set his sights on another black person just blocks away but something reportedly  spooked him. He appeared to be very close, following a black guy,  a source said.  He slows down and at one point he turned around and came back. It s clear he was really focused on the guy for some time. Then, he falls out of camera view and doesn t attack the guy. He made statements that he was following the guy but something spooked him. Jackson was arrested on a charge of second-degree murder, but the chief said they wanted to upgrade the charge by classifying it a hate crime.Watch:.@NYPDMTS walk James Harris Jackson, an army veteran & member of a hate group in Maryland, accused of killing a #NYC black man @NYDNVideo pic.twitter.com/DWwGxM0GgG  Edgar Sandoval (@edjsandoval) March 22, 2017Surveillance video of Jackson near the scene:Jackson admitted to police that he was a member of a white supremacist group and said that he detailed his racist views on his laptop computer, according to the Daily News.Jackson told the authorities that he initially wanted to stab a black man, then grab a police officer s gun and  shoot some people,  a police source said.Aubry said,  He wanted to make a statement. Jackson told police that he has been  harboring (racist) feelings for quite some time,  and it s believed he had these feelings for over 10 years, police said. He knew what he was doing when he was coming up here,  Aubry said at a press conference.  It is believed he was specifically intending to target male blacks. It s been well over 10 years that he has been harboring his hate towards blacks. Jackson reportedly said he doesn t like interracial relationships. More than an unspeakable human tragedy, this is an assault on what makes this the greatest city in the world: our inclusiveness and our diversity,  Mayor de Blasio said Wednesday.  Now it s our collective responsibility to speak clearly and forcefully in the face of intolerance and violence   here or across the country. We are a safe city because we are inclusive. We are a nation of unrivaled strength because we are diverse. No act of violence can undermine who we are. The last words Caughman said to his attacker were,  What are you doing? Good question.Image via screen capture.",2 (Disrespect),3 (Hostile),3 (Hostile),0 (Neutral),4
"Brexiters set up demented ‘people’s courts’ 07-11-16 BREXIT supporters have set up a network of ‘people’s courts’ where justice is based on popular opinion. Anti-EU Britons’ dissatisfaction with the legal system has led to the creation of makeshift courts dealing with everything from witchcraft to disputes over borrowed garden tools. Accountant and people’s judge Roy Hobbs said: “The court convenes in my living room, with the legal cases argued by our ‘barristers’ Sandra the local florist and Degsy, an unemployed decorator who’s seen A Few Good Men five times. “Our biggest case so far has been the legality of Brexit. The court came to the unanimous decision that it is totally brilliant and anyone who disagrees deserves a toe up their arse. “You can accuse anyone of anything. Last week we dealt with 48 cases of people being shortchanged at the local Sainsbury’s, a French spy and an old lady who put a curse on a horse than made it go lame. “Punishments range from the stocks for not wearing a poppy to hanging for more serious crimes, such as men having long hair. “Tomorrow I’ve got the case of a man who’s guilty of liking Nicola Sturgeon. He won’t be spouting his lies when he’s being hit in the forehead by turnips.” 
Share:",2 (Disrespect),3 (Hostile),3 (Hostile),1 (Mild),3
"Facebook Caught Selling Targeted Advertisement Which Excludes Different Races 
Andrew Anglin Daily Stormer October 29, 2016 ""This is massively illegal,"" said one lawyer when shown Facebook's ad targeting system allows excluision by race. https://t.co/bCn8fLT529 pic.twitter.com/i62jKP5b8W 
This is so, so funny. 
The top SJW kike himself, Mark Zuckerberg, has been caught using logical means to sell advertisements. 
But logic, we goyim have been told, is pure hatred. 
No idea why they thought they could get away with this. 
RT : 
A scandal is brewing over the discovery that advertisers on Facebook can ânarrowâ their audience by race and ethnicity, allowing them to remove their ads from the feeds of selected demographics, including African American, Asian and Hispanic. 
Micro-targeting, which assigns an ethnicity to users based on their page activity, is designed by Facebook to be used to target niche audiences, but it also allows for exclusion. Facebook claims advertisers are prohibited from abusing the tool, such as using it to discriminate. 
An ad purchased by ProPublica gave them the option to remove certain ethnic groups from viewing a housing ad. 
âThis is horrifying. This is massively illegal. This is about as blatant a violation of the federal Fair Housing Act as one can find,â civil rights lawyer John Relman told the publication. 
Facebook responded to ProPublicaâs report saying they believed, âmulticultural advertising should be a tool for empowerment,â adding that they expect advertisers to use the service in compliance with the law. 
âWhen World Cup 2014 became a big focus throughout the US Hispanic community, a business developed a campaign to reach people who had shown interest in that community in order to create a positive association between its brand and the worldâs most popular sport. This meant more relevant ads to those audiences about the World Cup,” the social media giant said, pointing out an example of micro-targeting being used successfully. 
Facebook also said that ads in different languages were another example of the feature being useful for its clients. 
It was a clever troll. 
I am in awe. 
I of course don’t think this should be illegal – it is absolutely nonsensical to make it illegal to prefer certain races over another in any context. Even if you believe “race doesn’t exist,” the fact remains that the different races statistically act very differently from each other, so very much can be determined about a person by knowing their race. 
But it is so funny to see the SJW Jew Zuckerberg caught in his own Jew web of nonsensical gibberish.",2 (Disrespect),2 (Disrespect),2 (Disrespect),1 (Mild),4
"Of course tomorrow morning, the Democrat Party will put their heads together and after hours of damage control, they will tell Americans Wasserman-Schultz didn t really mean what she said. What is it about women in the Democrat Party (Hillary) who don t really mean what they say?The Democratic National Committee has released a statement about the shooting of 11 police officers in Dallas tonight. The shooting took place at a Black Lives Matter protest against the deaths of Alton Sterling and Philando Castile at the hands of police this week. In a press conference, the chief of the police department clearly said that there is no known link between the snipers and the protesters.Chairwoman Debbie Wasserman Shultz didn t get that memo. The statement from the DNC looks like this:Pay attention to that penultimate paragraph. The last line, in particular, is noteworthy. And while most protesters have made their voices heard peacefully, tonight s shooting of officers in Dallas is unacceptable and a reminder that the time to address these tensions and find common ground is long overdue. What are you implying here, DWS?Image via: TwitterVia: Mediate",2 (Disrespect),1 (Mild),0 (Neutral),1 (Mild),2
"WikiLeaks: Neera Tanden has ANOTHER ringing endorsement for Hillary! (No, not really) Posted at 3:21 pm on October 29, 2016 by Doug P. 
As emails released by WikiLeaks have revealed, Hillary Clinton adviser and Center for American Progress President Neera Tanden has demonstrated brutal honesty when it comes to the Clintons’ dealings, and a new email released today is no different: Neera Tanden knows (and she spells like Trump!): ""Sometimes HRC/WJC have the worst judgement"" https://t.co/hRSAhG2eua pic.twitter.com/cTs0oGSb4m",1 (Mild),1 (Mild),1 (Mild),1 (Mild),1
"Like Megyn Kelly, who lost her supporters when she became obsessed with destroying Donald Trump, it s time for Shepard Smith to go. Let s face it, he would be much better suited for the small audiences of liberal viewers on CNN or MNSBC.It s time to go Shep and today s rant is a perfect example of why:Clip: @ShepNewsTeam sticks up for CNN's Jim @Acosta   & went further  pic.twitter.com/iITXqAzXXF  johnny dollar (@johnnydollar01) February 16, 2017Remember the time Shepard Smith cut off his guest s mic when they attempted to tie Black Lives Matter to the kidnapping and torture of the young special needs white man by 4 young black thugs?It s not the first time Hillary supporter Shepard Smith went off on an anti-Trump tangent. Watch him go off on Trump here and tell him what he needs to do to win the election. Great advice Shep. I guess it s pretty clear Trump didn t need your advice. LOL!https://www.youtube.com/watch?v=gcaoVuTvvoE",1 (Mild),1 (Mild),1 (Mild),1 (Mild),2
"The EU has opened the floodgates to Muslims from the Middle East and Africa who have no interest in assimilating. Did anyone really believe they would be able to maintain their history and their culture? Remember when people dreamed about going on a European vacation?Austrians fear parts of Vienna are becoming no-go areas after a father was attacked by a  Sharia patrol  when he told them to stop threatening his wife and daughter for not being correctly dressed.As various factions of migrants stake claims to territory in the city, it has been reported that the self-styled Sharia patrols have been visiting clubs and bars in the Millennium City area to make sure Chechen women were properly dressed and acting appropriately.However, when one Austrian man tried to step in to stop the patrol from hassling his Chechen wife and daughter, he ended up being hospitalised.It came as violence escalated across Vienna at the weekend, with more than 50 young men from the Afghan and Chechen communities clashing in the city centre.The gang had attacked each other with planks of wood, iron bars and knives. Two of those injured are in intensive care and their condition is described as critical.Police say that the row   which involved around 40 people from Afghanistan attacking 10 from Chechnya   had centred around a social media row on Facebook.Six of the alleged asylum seekers from Afghanistan have been arrested. The rest have escaped.Local couple Thomas and Manuela Sonntagfruh, standing on the bloodstained ground after the carnage at the weekend, said:  It is quite common that young people might argue, but something like this just isn t normal. The latest incident follows on from mass punch-ups not only in other parts of Vienna, but also in the cities of Linz, Graz, Sankt Polten and in Salzburg. Via: Daily Mail ",2 (Disrespect),2 (Disrespect),3 (Hostile),3 (Hostile),4
"Several team owners said they would come down hard on any drivers who did not stand during the national anthem. That included NASCAR legend Richard Petty, owner of Richard Petty Motorsports. Anybody that don t stand up for the anthem oughta be out of the country, period,  Petty said (via the Associated Press).  What got  em where they re at? The United States. When Petty was asked if his drivers would be fired if they protest during the anthem as Trump called for, Petty emphatically said,  You re right. Richard Petty Motorsports currently employs Bubba Wallace, who recently became the first black driver in a NASCAR race in over a decade.Richard Childress, owner of Richard Childress Racing, also said he would not tolerate any drivers who do not stand during the anthem. It ll get you a ride on a Greyhound bus,  Childress said.  Anybody that works for me should respect the country we live in. So many people gave their lives for it. This is America. All drivers reportedly stood during the anthem prior to Sunday s race in New Hampshire.For entire story: Business Insider ",1 (Mild),1 (Mild),1 (Mild),1 (Mild),2
"WASHINGTON (Reuters) - Leandra English, who is in a legal battle with the Trump administration over who is acting director of the Consumer Financial Protection Bureau, will spent Tuesday working in the office, she said in a statement. “I plan on spending the day at CFPB headquarters taking calls and meetings with external stakeholders and bureau staff,” she said in a statement. ",2 (Disrespect),0 (Neutral),0 (Neutral),0 (Neutral),0
"WASHINGTON (Reuters) - President Barack Obama on Friday will deliver a statement “on the economy and new steps to strengthen financial transparency and combat money laundering, corruption, and tax evasion,” the White House said. Obama is scheduled to make the remarks at 12:05 EDT (1605 GMT) at the White House, it said in a statement. ",1 (Mild),0 (Neutral),0 (Neutral),0 (Neutral),0
Nice try BUT WE RE NOT BUYIN  IT!,1 (Mild),0 (Neutral),0 (Neutral),0 (Neutral),1
"Posted: Nov 9th, 2016 by Guest Click for more article by Guest .. More Stories about: Ticker",0 (Neutral),0 (Neutral),0 (Neutral),0 (Neutral),0
"

October 31st, 2016 - Fort Russ News - 
RT -  by  Inessa Sinchougova 



Clinton's circus continues its tour. Joaquin Flores is the Editor in Chief here on Fort Russ. 



     Follow us on Facebook!                                                                                                      
       Follow us on Twitter!                                
             Donate! ",2 (Disrespect),0 (Neutral),0 (Neutral),1 (Mild),1
